{
  "schemaVersion": "3.0.0",
  "id": "set-annual-2023-b",
  "revision": 2,
  "title": "2023年度 公開問題",
  "subject": "B",
  "questionRefs": [
    {
      "questionId": "question-ipa-2023-b-1",
      "revision": 2
    },
    {
      "questionId": "question-ipa-2023-b-2",
      "revision": 2
    },
    {
      "questionId": "question-ipa-2023-b-3",
      "revision": 2
    },
    {
      "questionId": "question-ipa-2023-b-4",
      "revision": 2
    },
    {
      "questionId": "question-ipa-2023-b-5",
      "revision": 2
    },
    {
      "questionId": "question-ipa-2023-b-6",
      "revision": 2
    }
  ],
  "examConfigRefs": [
    {
      "id": "exam-annual-2023-b-study",
      "revision": 1
    },
    {
      "id": "exam-annual-2023-b-practice",
      "revision": 1
    }
  ],
  "distribution": "included",
  "generationBindings": []
}
